{
  "v": 1,
  "id": "00000000-0000-4000-8000-000000000201",
  "type": "discovery.start",
  "ts": "2026-01-01T00:00:00Z",
  "source": "openhdo-server",
  "correlation_id": "00000000-0000-4000-8000-000000000201",
  "payload": {
    "session_id": "00000000-0000-4000-8000-000000000202",
    "timeout_s": 30
  }
}
