{
  "v": 1,
  "id": "00000000-0000-4000-8000-000000000107",
  "type": "light.command.rgb_color",
  "ts": "2026-01-01T00:00:02Z",
  "source": "client.dashboard",
  "correlation_id": "00000000-0000-4000-8000-000000000108",
  "payload": {
    "light_id": "living-room-lamp",
    "command_id": "00000000-0000-4000-8000-000000000109",
    "idempotency_key": "living-room-lamp-rgb-color-001",
    "rgb_color": {"r": 255, "g": 96, "b": 32}
  }
}
