{
  "v": 1,
  "id": "00000000-0000-4000-8000-000000000001",
  "type": "link.register",
  "ts": "2026-01-01T00:00:00Z",
  "source": "linker.example",
  "payload": {
    "id": "linker.example",
    "version": "0.1.0",
    "name": "Example OpenHDO Linker",
    "transports": ["zigbee", "bluetooth"]
  }
}
