{
  "v": 1,
  "id": "00000000-0000-4000-8000-000000000011",
  "type": "pairing.start",
  "ts": "2026-01-01T00:00:00Z",
  "source": "openhdo-server",
  "correlation_id": "00000000-0000-4000-8000-000000000011",
  "payload": {
    "session_id": "00000000-0000-4000-8000-000000000012",
    "discovery_session_id": "00000000-0000-4000-8000-000000000013",
    "candidate_id": "light.discovered",
    "timeout_s": 30
  }
}
