{
  "v": 1,
  "id": "00000000-0000-4000-8000-000000000120",
  "type": "link.register",
  "ts": "2026-01-01T00:00:05Z",
  "source": "linker.example",
  "payload": {
    "id": "linker.example",
    "version": "0.1.0",
    "name": "Example OpenHDO Linker",
    "transports": ["zigbee"],
    "devices": [
      {
        "id": "living-room-lamp",
        "name": "Living room lamp",
        "capabilities": [
          {
            "kind": "light",
            "power": true,
            "brightness": {"min": 0, "max": 255},
            "color_modes": ["RGB"],
            "rgb_channel_range": {"min": 0, "max": 255}
          }
        ]
      }
    ]
  }
}
