{
  "v": 1,
  "id": "00000000-0000-4000-8000-000000000204",
  "type": "discovery.completed",
  "ts": "2026-01-01T00:00:30Z",
  "source": "linker.example",
  "correlation_id": "00000000-0000-4000-8000-000000000201",
  "payload": {
    "session_id": "00000000-0000-4000-8000-000000000202",
    "status": "completed",
    "error": null
  }
}
