{
  "v": 1,
  "id": "00000000-0000-4000-8000-000000000110",
  "type": "light.state.reported",
  "ts": "2026-01-01T00:00:03Z",
  "source": "linker.example",
  "payload": {
    "light_id": "living-room-lamp",
    "power": true,
    "brightness": 255,
    "rgb_color": {"r": 255, "g": 96, "b": 32},
    "state_revision": 41
  }
}
