{
  "v": 1,
  "id": "00000000-0000-4000-8000-000000000104",
  "type": "light.command.brightness",
  "ts": "2026-01-01T00:00:01Z",
  "source": "client.dashboard",
  "correlation_id": "00000000-0000-4000-8000-000000000105",
  "payload": {
    "light_id": "living-room-lamp",
    "command_id": "00000000-0000-4000-8000-000000000106",
    "idempotency_key": "living-room-lamp-brightness-001",
    "brightness": 65
  }
}
