{
  "v": 1,
  "id": "00000000-0000-4000-8000-000000000101",
  "type": "light.command.power",
  "ts": "2026-01-01T00:00:00Z",
  "source": "client.dashboard",
  "correlation_id": "00000000-0000-4000-8000-000000000102",
  "payload": {
    "light_id": "living-room-lamp",
    "command_id": "00000000-0000-4000-8000-000000000103",
    "idempotency_key": "living-room-lamp-power-001",
    "power": true
  }
}
